{
  "schema_version": 1,
  "manifest_id": "mozart-training-dataset-v1",
  "status": "template",
  "license_policy": "commercial-compatible-only",
  "project_vocabulary_id": "mozart-midi-events-v1",
  "sources": [
    {
      "source_id": "example-source",
      "name": "REPLACE_WITH_AUDITED_SOURCE",
      "locator": "https://example.invalid/source",
      "revision": "REPLACE_WITH_IMMUTABLE_REVISION",
      "license": {
        "spdx_id": "REPLACE",
        "commercial_use": "requires-review",
        "redistribution": "requires-review",
        "attribution": "requires-review",
        "notes": "Template only. No production dataset is approved by this file."
      },
      "files": [
        {
          "path": "REPLACE",
          "sha256": "REPLACE",
          "size_bytes": 0
        }
      ],
      "provenance": {
        "provider": "REPLACE",
        "acquisition_date": "YYYY-MM-DD",
        "rights_evidence": "REPLACE"
      }
    }
  ],
  "splits": {
    "train": "REPLACE",
    "validation": "REPLACE",
    "test": "REPLACE"
  },
  "normalization": {
    "revision": "mozart-midi-normalization-v1",
    "ticks_per_quarter_policy": "resample_to_480",
    "tempo_policy": "preserve_tempo_events",
    "meter_policy": "preserve_supported_time_signatures",
    "channel_policy": "preserve_0_15; drums_use_channel_9",
    "note_policy": "drop_invalid; clamp_never",
    "velocity_policy": "map_to_32_bins",
    "duration_policy": "quantize_to_1_16_beat_grid",
    "time_shift_policy": "encode_using_mozart_64_bin_time_shifts",
    "controller_policy": "encode_0_127_controller_and_32_value_bins",
    "deduplication": "canonicalize_identical_events",
    "max_events_per_example": 4096
  },
  "examples": {
    "min_bars": 4,
    "max_bars": 16,
    "context_length_tokens": "REPLACE_AFTER_MODEL_SELECTION",
    "max_generated_tokens": "REPLACE_AFTER_MODEL_SELECTION"
  },
  "checksums": {
    "manifest_sha256": "NOT_COMPUTED_IN_TEMPLATE"
  }
}
